[
  {
    "id": "course-anthropic-prompt-engineering",
    "title": "Anthropic Prompt Engineering Interactive Tutorial",
    "provider": "Anthropic",
    "canonical_url": "https://github.com/anthropics/prompt-eng-interactive-tutorial",
    "description": "Official nine-chapter interactive tutorial that teaches Claude prompting with ordered lessons, playgrounds, and exercises. Free to follow; API usage may incur provider charges.",
    "resource_type": "interactive_tutorial",
    "access_model": "free",
    "credential_outcome": "no_credential",
    "related_credential_ids": [],
    "level": "mixed",
    "language": "English",
    "hands_on": true,
    "prompt_engineering_relevance": "direct",
    "relevance_rationale": "The entire curriculum is dedicated prompt-engineering technique practice for Claude.",
    "related_lessons": [
      "02-prompt-anatomy",
      "03-core-techniques"
    ],
    "status": "active",
    "last_verified": "2026-08-01",
    "stale_after_days": 120,
    "stale_risk": "medium"
  },
  {
    "id": "course-anthropic-prompt-evals",
    "title": "Anthropic Prompt Evaluations",
    "provider": "Anthropic",
    "canonical_url": "https://github.com/anthropics/courses/tree/master/prompt_evaluations",
    "description": "Official Anthropic courses material focused on evaluating prompts and LLM outputs through guided exercises rather than a marketed certificate track.",
    "resource_type": "exercise_repository",
    "access_model": "free",
    "credential_outcome": "no_credential",
    "related_credential_ids": [],
    "level": "mixed",
    "language": "English",
    "hands_on": true,
    "prompt_engineering_relevance": "direct",
    "relevance_rationale": "Exercises center on prompt evaluation design and judging Claude outputs.",
    "related_lessons": [
      "06-evaluation"
    ],
    "status": "active",
    "last_verified": "2026-08-01",
    "stale_after_days": 120,
    "stale_risk": "medium"
  },
  {
    "id": "course-microsoft-generative-ai-solutions",
    "title": "Build Effective Generative AI Solutions in Your Organization",
    "provider": "Microsoft Learn",
    "canonical_url": "https://learn.microsoft.com/en-us/training/modules/build-effective-generative-ai-solutions-organization/",
    "description": "Microsoft Learn module with ordered units on prompting, grounding, trust, and when to use machine learning. A signed-in module assessment can add a pass designation to a Learn profile; that is not a formal certification.",
    "resource_type": "structured_course",
    "access_model": "free_with_account",
    "credential_outcome": "completion_record",
    "related_credential_ids": [],
    "level": "beginner",
    "language": "English",
    "hands_on": false,
    "prompt_engineering_relevance": "substantial_component",
    "relevance_rationale": "Includes an explicit prompt-engineering unit inside a broader generative-AI leadership module.",
    "related_lessons": [
      "00-orientation",
      "02-prompt-anatomy",
      "04-grounding-and-long-context"
    ],
    "status": "active",
    "last_verified": "2026-08-01",
    "stale_after_days": 120,
    "stale_risk": "medium"
  },
  {
    "id": "course-microsoft-azure-openai-exercises",
    "title": "Azure OpenAI Exercises",
    "provider": "Microsoft Learning",
    "canonical_url": "https://microsoftlearning.github.io/mslearn-openai/",
    "description": "Guided lab exercises that support Microsoft Learn Azure OpenAI modules. Useful practice material, not a standalone certificate-bearing course.",
    "resource_type": "guided_lab",
    "access_model": "free",
    "credential_outcome": "no_credential",
    "related_credential_ids": [],
    "level": "mixed",
    "language": "English",
    "hands_on": true,
    "prompt_engineering_relevance": "substantial_component",
    "relevance_rationale": "Labs practice prompting and Azure OpenAI application patterns that accompany Learn modules.",
    "related_lessons": [
      "03-core-techniques",
      "07-agents-and-tools"
    ],
    "status": "active",
    "last_verified": "2026-08-01",
    "stale_after_days": 120,
    "stale_risk": "medium"
  },
  {
    "id": "course-google-generative-ai-learning",
    "title": "Google Cloud Generative AI Learning Path",
    "provider": "Google Cloud / Google Skills",
    "canonical_url": "https://www.skills.google/paths/118",
    "description": "Official Google Skills learning path for generative AI. Lesson access is broadly available, while some labs may require Skills Boost credits or a subscription. A path badge or completion record is not a formal certification; confirm any assessed credential on the issuer exam pages.",
    "resource_type": "learning_path",
    "access_model": "lab_credits",
    "credential_outcome": "skill_badge",
    "related_credential_ids": [],
    "level": "mixed",
    "language": "English",
    "hands_on": true,
    "prompt_engineering_relevance": "substantial_component",
    "relevance_rationale": "Path covers generative-AI practice including prompting and model-output improvement techniques on Google Cloud.",
    "related_lessons": [
      "03-core-techniques",
      "10-multimodal"
    ],
    "status": "active",
    "last_verified": "2026-08-01",
    "stale_after_days": 60,
    "stale_risk": "high"
  },
  {
    "id": "course-nvidia-generative-ai-llm-path",
    "title": "NVIDIA Generative AI and LLM Learning Path",
    "provider": "NVIDIA",
    "canonical_url": "https://www.nvidia.com/en-us/learn/learning-path/generative-ai-llm/",
    "description": "Official NVIDIA learning-path landing page that lists multiple free and paid DLI courses and workshops, including Building LLM Applications With Prompt Engineering. The path itself is not one single enrolled course.",
    "resource_type": "learning_path",
    "access_model": "freemium",
    "credential_outcome": "no_credential",
    "related_credential_ids": [],
    "level": "mixed",
    "language": "English",
    "hands_on": true,
    "prompt_engineering_relevance": "substantial_component",
    "relevance_rationale": "Path explicitly includes a dedicated prompt-engineering LLM application course among broader generative-AI offerings.",
    "related_lessons": [
      "03-core-techniques",
      "07-agents-and-tools"
    ],
    "status": "active",
    "last_verified": "2026-08-01",
    "stale_after_days": 60,
    "stale_risk": "high"
  },
  {
    "id": "course-deeplearning-ai-chatgpt-prompt-engineering",
    "title": "ChatGPT Prompt Engineering for Developers",
    "provider": "DeepLearning.AI / OpenAI",
    "canonical_url": "https://www.deeplearning.ai/courses/chatgpt-prompt-eng",
    "description": "Short structured course by Isa Fulford and Andrew Ng covering prompt principles and API-based tasks such as summarizing, inferring, transforming, expanding, and chatbot building. Free course access is currently offered; graded accomplishment is tied to a paid PRO plan.",
    "resource_type": "structured_course",
    "access_model": "free_audit_paid_certificate",
    "credential_outcome": "completion_record",
    "related_credential_ids": [],
    "level": "beginner",
    "language": "English",
    "hands_on": true,
    "prompt_engineering_relevance": "direct",
    "relevance_rationale": "The course is purpose-built to teach prompt engineering for developer workflows with OpenAI APIs.",
    "related_lessons": [
      "02-prompt-anatomy",
      "03-core-techniques"
    ],
    "status": "active",
    "last_verified": "2026-08-01",
    "stale_after_days": 90,
    "stale_risk": "high"
  },
  {
    "id": "course-aws-foundations-of-prompt-engineering",
    "title": "Foundations of Prompt Engineering",
    "provider": "AWS Skill Builder",
    "canonical_url": "https://explore.skillbuilder.aws/learn/course/17763/foundations-of-prompt-engineering",
    "description": "Official AWS Skill Builder digital course covering prompt fundamentals through advanced techniques and misuse defenses. Course access is free with an AWS Skill Builder account; related AWS certifications remain separate paid exams.",
    "resource_type": "structured_course",
    "access_model": "free_with_account",
    "credential_outcome": "no_credential",
    "related_credential_ids": [],
    "level": "beginner",
    "language": "English",
    "hands_on": true,
    "prompt_engineering_relevance": "direct",
    "relevance_rationale": "AWS positions the course as dedicated prompt-engineering training from basics through advanced techniques.",
    "related_lessons": [
      "02-prompt-anatomy",
      "03-core-techniques",
      "09-security"
    ],
    "status": "active",
    "last_verified": "2026-08-01",
    "stale_after_days": 90,
    "stale_risk": "high"
  }
]
